{
  "version": "0.95.22",
  "notes": "Ghost FTP 0.95.22",
  "pub_date": "REPLACE_WITH_RFC3339",
  "platforms": {
    "windows-x86_64": {
      "url": "https://github.com/bren-wp/Ghost-FTP/releases/download/v0.95.22/GhostFTP-Windows-x64-Setup-v0.95.22.exe",
      "signature": "REPLACE_WITH_CONTENTS_OF_WINDOWS_SIG"
    },
    "linux-x86_64": {
      "url": "https://github.com/bren-wp/Ghost-FTP/releases/download/v0.95.22/GhostFTP-Linux-x86_64-v0.95.22.AppImage",
      "signature": "REPLACE_WITH_CONTENTS_OF_LINUX_SIG"
    }
  }
}
